{
  "domain_name": "cloudsync.io",
  "zone_id": "zone_abc123def456",
  "records_created": [
    {
      "type": "A",
      "name": "@",
      "content": "76.76.21.21",
      "proxied": false,
      "record_id": "rec_aaa111bbb222"
    },
    {
      "type": "CNAME",
      "name": "www",
      "content": "cname.vercel-dns.com",
      "proxied": false,
      "record_id": "rec_ccc333ddd444"
    }
  ],
  "vercel_domain_added": true,
  "ssl_mode": "dns_only",
  "created_at": "2026-04-27T15:35:00Z"
}
